订单总价,供应商名称
7000,北京蓝兴彩虹科技有限公司
53,广州西门图书有限公司
6195.64,广州天洋生物科技有限公司
720,深圳市福田区赛格电子市场加辉电子经营部
220,延边寒晓干冰销售有限公司
1420,天津市河北区高仕横源实验室设备销售中心
5890,深圳市欣启生物科技有限公司
2210,深圳市欣博盛生物科技有限公司
82500,上海博戎生物科技有限公司
1326,榆轩仪器厂
208,武义芝浦工具有限公司
354,海门市文郝实验器材经营部
460,陕西欧迅机电科技有限公司
2800,临夏市信诺天成科技有限公司
5100,深圳市南山区大勘张记五金店
3931.04,深圳市博飞生物技术有限公司
9699.97,深圳市鸿泰云光科技有限公司
435,深圳瑞升模具有限公司
489,上海臻品电子商务有限公司
194.6,三明飞鸽网络技术有限公司
1649.5,广州市速为电子科技有限公司
1800,深圳市天成伟业电子科技有限公司
420,上海帝志传动配件有限公司
353.5,深圳市宝安区沙井宏翔工控配件经营部
347,东莞市爱科特家居用品有限公司
921.1,杭州苏明五金经营部
1300,深圳市南山区深宏佳数码经营部
1160,上海瑞林半导体材料有限公司
15300,广州市本原纳米仪器有限公司
31731,上海瀚宇光纤通信技术有限公司
10950,东莞市汇欧五金家具制造有限公司
3400,上海宏端精密机械有限公司
9400,开化立晶硅材料经营部
36,苏州一加一不锈钢制品有限公司
179.5,兴化市优源不锈钢制品有限公司
269.7,兴化市莱凯五金制品经营部
88,上海录螺机电器经营部
28.6,深圳市斯勃锐五金有限公司
84684.31,深圳市鑫明五金制品有限公司
28,东莞京东利升
24.16,伊莱科五金机电专营店
78580,深圳市福田区万胜电子经营部
16100,深圳市喜顺隆五金配件商行
59927.2,深圳今斯生物科技有限公司
520,珠海市南屏向上文具配送中心
7390,武汉康昕瑞基因健康科技有限公司
29208,深圳华因康基因科技有限公司
46196,东仁化学科技（上海）有限公司
25544,广州康昕瑞基因健康科技有限公司
20930,上海诺优生物科技有限公司
21211,广州安绅商贸有限公司
150,东莞市祥和金属材料
2580,科博化仪（北京）科技发展有限公司
3900,挨斯珂智能科技（深圳）有限公司
254.4,铭丰塑料
11300.01,深圳市丰得电路科技有限公司
500,深圳市龙岗区金联威不锈钢经营部
293,上海毕得医药科技有限公司
2940,上海彭滕精细化工有限公司
12028,上海志成国际贸易有限公司
16415,深圳市中能湿科电器有限公司
43088.5,深圳市华安天下科技有限公司
25977,深圳市南山区赛格鹏星电脑经营部
4265,北京中镜科仪技术有限公司
10657,深圳市九影科技有限公司
1700,广州昕宇服饰有限公司
128,深圳市佰茂机械配件有限公司
327,常州路易电动推杆有限公司
449,上海尼雅孜信息技术有限公司
362,深圳市度点科技有限公司
118.35,深圳市福田区新亚洲电子市场二期睿捷电子商行
927,苏州佐夫电子有限公司
3350,无锡瑞科华泰电子技术有限公司
99.96,广州晶东贸易邮箱公司
1500,东莞市长安逸夫自动化设备经营部
2280,临沂市凯兴电气有限公司
12138,上海易励医疗器械有限公司
200,有研工程技术研究院有限公司
4000,长春市泰元氟金云母有限公司
1951.17,武汉高仕睿联科技有限公司
194582.4,深圳市圳诚科技有限公司
750,巩义市予华仪器有限责任公司
7950,天津市基理科技股份有限公司
1350,深圳卡奥博科技有限公司
48590,深圳市云飞龙特种气体有限公司
70304.8,广州筱迪生物科技有限公司
2040,深圳市云飞龙特种气体有限公司2
34598,湖南丙戈信息科技有限公司
570,昆山市玉山镇亿旺鑫新材料经营部
83676,深圳市华运科学仪器有限公司
1524,玉田县鸦鸿桥镇午阳塑料制品经销处
19240.38,深圳市创美实业有限公司
49686.89,深圳市康贝科学仪器有限公司
130,济南鼎鑫贤鲁贸易有限公司
520,深圳市达科为生物科技有限公司
270,郑州博洋仪器仪表有限公司
52.3,常州市全友文化用品有限公司
105.6,福州台江区金榜图书有限公司
105.8,北京蓝墨水文化有限公司
218,上海舒展贸易有限公司
1150,深圳市南山区文仪劳保文具商行
3692,莱山区江业硅胶制品经营部
346891.9,增城市和康贸易有限公司
87500,深圳市致依科技有限公司
850,巩义市予华仪器设备有限公司
898,深圳市金誉信电子有限公司
11650,净月高新技术产业开发区天成云母制品经销处
425,洛阳尚卓科技有限公司
5440,深圳市一通医疗器械有限公司
7125,深圳垦拓流体控制有限公司
49659.77,深圳新智成科技有限公司
16077,深圳市我行体育文化发展有限公司
1240,东莞市优优金属材料有限公司
950.01,晨政图文设计中心
31719,深圳数云图科技有限公司
1744.71,淘宝店家
12964.5,北京洋天科技有限公司
1452,广州先度生物科技有限公司
10000,荆门市万佳暖通科技有限公司
750,胡运涛高宝卫浴
53,衡水欧然商贸有限公司
3547.62,武汉京东金德贸易有限公司
1000,北京飞驰科学仪器有限公司
117980.74,深圳智源达科技有限公司
2298.06,深圳市山盛科技有限公司
680,深圳市红草科技有限公司
187.5,深圳市福田区东裕远大电子经营部
30,深圳市新健盛电子有限公司
1200,天津市风船化学试剂科技有限公司
315.21,盐城鼎和信实验器材有限公司
61,河北华恩医疗器械有限公司
64,广东豫兆临药业连锁股份有限公司
341.99,清华大学出版社有限公司
274.5,上海顶昊商贸有限公司
170,杭州爱凯医疗用品有限公司
441.4,国家税务总局深圳市税务局
215,西安沐易家具用品有限公司
139432.72,深圳辉诺生物科技有限公司
7730,深圳市熠星安科技有限公司
168,上海胜时信息科技有限公司
158.97,昆山京东尚信贸易有限公司
29197,广州诺特生物科技有限公司
1350,西安凯新生物科技有限公司
11511,深圳莱博威科技有限公司
3141,益阳湘城华南光电有限公司
2400,深圳市矽谷溅射靶材有限公司
230,嘉兴尚品电子商务有限公司
206.96,深圳市妙家科技有限公司
23000,北京安必奇生物科技有限公司
63406,深圳众石科学仪器有限公司
980,江苏科欣仪器有限公司
1950,国家税务总局深圳市龙华区税务局
795,清河县创盈金属材料有限公司
1388.89,上海张清贸易有限公司
116,上海敏焱橡塑制品有限公司
3400,北京理加联合科技有限公司
21064,深圳凯胜生物科技有限公司
3438,"深圳凯胜 生物科技有限公司"
1185,北京义翘神州科技有限公司
676,广东医学实验动物中心
11650,深圳市南山区恒腾达电子经营部
95500,上海韧致贸易中心
3323,深圳博瑞科技仪器有限公司
9840,深圳博瑞科学仪器有限公司
243,建湖县芦沟镇电热器经营部
1617,上海希丙实业有限公司
1065,湖南力辰仪器科技有限公司
260,睢宁县姚集镇新晨五金经营部
730.08,佛山市斯亭真空贸易有限公司
800,深圳市西林电气技术有限公司
75752.6,深圳市南山区毓全实验室设备商行
1300,郑州金钻金刚石工具有限公司
266.77,诸暨市家鑫文具用品商店
8379,深圳市南山区泰普商贸行
22885,深圳市南山区西部菁英电子经营部
9900,深圳市南山区宇星电脑经营部
86009.34,thorlabs
10140,星紫（上海）新材料技术开发有限公司
700,北京泰科诺科技有限公司
11734,深圳市宝安区新安巴妮蔻科研服务中心
30443.6,上海碧云天生物技术有限公司南通分公司
239.8,南京凯斯德安全防护用品有限公司
53,淘宝彭朝文
59.7,宁波福茂通讯科技有限公司
16,广州市择育办公用品有限公司
17352.32,武汉微神科技发展有限公司
62,深圳市力特郎电池有限公司
360,上海雷磁传感器科技有限公司
5966,深圳市罗湖区佳胜兴五金商行
5900,深圳市搏艺装饰设计工程有限公司
2200,献县力量建筑器材经销处
35735,深圳市宝创混凝土有限公司
145,深圳市宝安区沙井金早利线材销售部
25,周宁县鸿顺复合材料经营部
5572,西安西尔威电子科技有限公司
22497.6,深圳市伯特利装饰设计工程有限公司
2785,深圳市佐料生物技术有限公司
3018.6,深圳凯创生物科技有限公司
26526,苏州研材微纳科技有限公司
1380,深圳深圳宏康悠生物科技有限公司
7200,宁波博润新材料科技有限公司
58283.82,北京柏岩科技有限公司
8746,广州科适特科学仪器有限公司
260,东莞市豫德机电设备有限公司
146202.15,深圳中拓扑生物科技有限公司
2750,东莞市优视自动化科技有限公司
1144,深圳市白鳍豚生物科技有限公司
2989,上海平轩科学仪器有限公司
635,上海良晶玻璃仪器厂
370,杭州胜利电子仪器有限公司
146,华宇玻璃仪器
53.9,深圳市冠捷电子商务有限公司
149.35,深圳市芯时代电子商务有限公司
47.5,金华馨友贸易有限公司
487,海门市乐豆办公用品经营部
34.6,苏州高新区狮山春满林贸易商行
960,西安天正药用辅料有限公司
18208,大赛璐药物手性技术（上海）有限公司
430.05,扬州惠民电气设备有限公司
10319.88,北京欣维尔玻璃仪器有限公司
285,沈阳弗仕德科技有限公司
218.4,东莞市竂步广雅包装制品厂
84,深圳市华南电商科技有限公司
5800.36,深圳市龙岗区乐幻智能经营部
15780,上海桂浦声生物科技有限公司
87452,华玥创新科技有限公司
10000,上海宥露生物科技有限公司
2180.04,芜湖蓝宙电子科技有限公司
3450,天津市高仕横源实验室设备销售中心
72,苏州箴全健身体育用品有限公司
298,FMS功能性运动测试套件有限公司
396,杭州咏乐汇贸易有限公司
696.5,义乌市重桓贸易有限公司
2399,北京海东世纪科贸有限公司
12255,深圳创异佳精密机械有限公司
15000,台州简兮贸易有限公司
44050,上海芃圣生物科技有限公司
59073.1,萨恩化学技术（上海）有限公司
1749.98,海门市南葵实验器材经营部
510,上海美钦电气有限公司
1010,北京泽佰斯特科技有限公司
1325,苏州海帝思电子科技有限公司
8400,东莞市欧莱溅射靶材有限公司
600,深圳市通离微纳科技有限公司
555,东营东工电子商务有限公司
512,扬中赛锡实验仪器经营部
1457,厦门科川科技有限公司
11405,苏州纳凯科技有限公司
2777,深圳市宝安区新安得正源电子商行
159.5,强力胜电线经营部
2388.22,谱焰实业（上海）有限公司
38,深圳市安普康电子有限公司
2883,广州市泽锦电子科技有限公司
400,长垣县安顺塑业销售部
2160,河南省三善电子商务有限公司
58256,广州旭泽生物科技有限公司
28395,北京六合华大基因科技有限公司广州分公司
34561,深圳艾普诺生物医疗科技有限公司
27459,北京诺禾致源科技股份有限公司
7600,北京科迈瑞科技有限责任公司
5959.63,索雷博光电
28800,杭州延源生物科技有限公司
85,广州市天雕展贸易有限公司
398,北京中诚实意五金交电有限公司
104,清远市峰联电子有限公司
27880,九焱科技（深圳）有限公司
639.15,上海思域化工科技有限公司
1378,东莞市寮步霖泰轴承商行
173.72,东莞市樟木头华辰塑胶原料商行
1900,武义科汇仪器有限公司
516.21,富邦电子科技有限公司
915,联高模具机械配件行
1538.1,深圳汇成五金有限公司
3000,苏州星烁纳米科技有限公司
380.11,上海瞬隽贸易商行
423,海门市真心实验器材经营部
574,佛山市达钊铝业有限公司
843,深圳市龙岗区德信通商店
16226,深圳市贝特瑞科技有限公司
7200,深圳市贝瑞特科技有限公司
2450,上海沃蓝
9580,北京博迈斯科技发展有限公司
8300,武汉星嘉浦科技有限公司
14000,临夏市泰诺科技有限公司
1571.4,国药集团化学试剂有限公司
4605,上海安谱实验科技股份有限公司
820.6,趣梦办公专营店
159,欣想数码电子经营部
19200,深圳市畅翔精工科技有限公司
9952,中天晨拓科技（北京）有限公司
23200,谱镭光电技术有限公司
86500,长春益航光电科技有限公司
99,武进区横山桥日月家具经营部
3750,深圳市龙华新区昌达利气体服务中心
25839.85,深圳四正柏生物科技有限公司
1500,高新园区阪和光电产品经营部
1800,上海富恒生物科技有限公司
4100,苏州锐材半导体有限公司
1094.85,深圳市无线创新科技有限公司、浙江市硕然电气有限公司、深圳市南山区鸿运通五金材料商店
85.5,格之格
1300,深圳市南山区赛格电子市场
1462.2,苏州工品汇信息科技有限公司
320.2,江都区浦头镇悦奇教学仪器经营部
17472,深圳市亚辉通生物科技有限公司
4024,深圳富途锐科技发展有限公司
1577.04,江苏圆周电子商务有限公司上海分公司
52.4,上海华心图书有限公司
28100,上海芯超生物科技有限公司
6600,深圳市莱菔生物科技有限公司
29820,深圳市铭智星科技有限公司
980,东莞市麻涌鑫诚干冰经营部
8700,上海强耀生物科技有限公司
424,item.taobao.com/item.htm?scm=1007.13982.82927.0&id=44455017375&last_time=1539930499
11277.13,昴氏电子贸易有限公司
7020,深圳市铧盛精密五金有限公司
200,天津试剂
762,武进区遥观体创教育器材经营部
803,深圳市弘兴科技有限公司
663,泉稷(上海)实业有限公司
330.148,深圳市汇成丰五金有限公司龙岗分公司
867,广州星瞳信息科技有限责任公司
54.5,乐清市淘聚贸易有限公司
28.404,深圳市斯勃五金有限公司龙岗分公司
213,深圳市哇噢电子有限公司
1199.37,东莞市微宏网络科技有限公司
1371.02,河北贝朗科技有限公司
101,东莞市新奇电子科技有限公司
168,深圳市福田区佳泰安防电子经营部
423.2,深圳市感为电子有限公司
379.995,深圳市福田区弘成基电子商行
881,深圳华强聚丰电子科技有限公司
1763.99,长沙市望城区海龙电子产品经营部
82.499999,深圳市龙岗区汇成丰螺丝店
36.75,深圳市光明新区公明志胜包装材料经营部
499,深圳市德维伊光学科技有限公司
40,上海金山国际贸易城市场经营管理有限公司
148.800001,乐清市柳市鑫磊塑料制品店
37.8,安庆市歌丽尔商贸有限公司
329.8,慈溪市周巷正浩轴承店
712,北海市铁山港区星邦五金电子经营部
718.119999,东莞市东坑广富传动配件经营部
42,深圳市福田区国家税务局代开九十九
135,东莞市麦科机器人贸易有限公司
9980,深圳市速达软件服务中心
115.14,信红安科学器材销售中心
950.77,荥阳豫力机械设备有限公司
106,永康市喜尚工贸易有限公司
49.9,武汉黑麦电子商务有限公司
177,北京金光佳美科技有限公司
18400,深圳市兴天美贸易有限公司
29777,深圳市胜达捷贸易有限公司
126,乐清市鼎泰气动液压有限公司
665.97,武汉京东德瑞贸易有限公司
59,东莞京东利昇莫贸易有限公司
85,温州扶泰无障碍设施有限公司
269,温州市扶泰无障碍设施有限公司
1239.92,河南汇曜商贸有限公司
21400,山东摩贝生物科技有限公司
429,上海百事得电子有限公司
18800,无锡瑞科华泰
700.7,深圳市利天顺电子有限公司
51.97,北京新阅文化发展有限公司
632.3,深圳市科天微电子有限公司
313,北京旷氏文豪文化有限公司
163,常州简尚家具有限公司
1144,深圳市妍妍科技有限公司
274.5,深圳市微科电子科技有限公司
47842,宁波远新光电技术有限公司
263.5,上海鹰谷信息科技有限公司
700,北京馨万家商贸有限公司
480,山东利特纳米技术有限公司
124,北京速得万通电子产品经营部
28699.04,深圳市福卫康生物科技有限公司
2400,广州市创联信息技术有限公司
364,北京京东世界信息技术有限公司
129,小米京东自营旗舰店
388,华谊（HYELEC)仪表京
61.75,绿联维联特专卖店
300,奥松机器人专营店
189721.55,深圳莱菔生物科技有限公司
1443,长沙科怡仪器设备有限公司
1751,海门市朵恩实验器材经营部
64.2,莆田市赞牛贸易有限公司
120,沐阳二豆电子商务有限公司
176,沐阳全友绿化工程有限公司
800,河南明海光电子科技有限公司
200,苏州碳丰科技有限公司
14750,广州市谱源气体有限公司
780,北京汇龙昌海科贸有限公司第一分公司
96,杭州萧山蜀山大手笔广告设计工作室
2040,上海安春仪器有限公司
64817.5,深圳市福田区赛格电子市场佳佳文电子经营部
46690,深圳市福田区维利创金电子商行
155,福州英菲迅光电科技
61.76,成都伊百特电子科技有限公司
212,深圳市云鹰网络科技有限公司
292,上海百甘电子商务有限公司
313.92,连云港米耀商贸有限公司
240,深圳化试有限公司
300000,赛业（苏州）生物科技有限公司
455,青岛光明星科贸有限公司
32895,海门市元盛实验器材销售部
6900,郑州凯默科电子科技有限公司
29300,深圳市袆德科技有限公司
400,波仕电子
43406,朗光科技
205,上海市黄浦区朝达电子经营部
37656,深圳市慧铭医科技有限公司
11950,深圳市宝安区松岗奥斯微电子经营部
598.97,青岛京东益昌得贸易有限公司
175501.43,深圳莱伯生物科技有限公司
2646,上海家驰科技有限公司
20000,上海未普光电科技有限公司
889,北京兰博利德商贸有限公司
978,广州白云区太和宏益诚塑胶经营部
599.1,献县试金五金工具销售部
267,无锡瓯邦诺科技有限公司
200,上海越磁电子科技有限公司
105,丽水市程翔轴承经营部
10684.5,北京南飞工贸有限公司
2575,深圳市赣龙贸易有限公司
197,天台金睿汽车用品有限公司
300,义乌市简佳日用品有限公司
2500,东海县驼峰乡美东石英制品厂
548.5,沈阳茂华生物科技有限公司
8082,广州雅至生物科技有限公司
14739,深圳市南山区新锋数码经营部
17390.1,北京通利华实验动物技术有限公司
210,苏州格勒实验室设备有限公司
1350,深圳马利画材专卖店
12209.51,三亚京东佳禹贸易有限公司
272.7,鑫亨霸
13800,深圳诚欣科技有限公司
21993,北京慧德易科技有限责任公司
16000,东莞市东榕测量仪器有限公司
87,佛山博世特五金商行
81.9,常州市西坑机电经营部
104,东莞俏巴模具五金配件有限公司
12790,深圳市慧铭医科技公司
9600,北京安泰可
419,桥西区永诚实验用品经销处
56519,北京中原合聚经贸有限公司
122.7,南京中译图书有限公司
68.32,徐州豪迪光电科技有限公司
230.4,徐州市欧科照明电器有限公司
73.73,中山市古镇光驰照明门市部
147.46,深圳市创海发电子有限公司
200,桐乡市洲泉黑马照明器材经营部
87.87,深圳科睿伟业科技有限公司
74.26,深圳市雅嘉美光电有限公司
6000,深圳市华祥达电子有限公司
800,四川兰博环保设备有限公司
51662.01,深圳市真好记贸易行
3684,吴中经济技术开发区爱尚园艺经营部
8100,山东科快生物科技有限公司
16700,东莞寮步
960,扬中市兴福达橡塑有限公司
2400,南山区博达
97810.7,selleck（中国，上海蓝木化工有限公司）
14800,深圳佳肽生物科技有限公司
5975,南京福克赛生物科技有限公司
201554.76,北京维通利华实验动物技术有限公司
1401.54,天台褚褚贸易有限公司
1233,上海俊汐工贸有限公司
595,兴化市贝诺特电池有限公司
245,深圳市南山区诚利广五金商行
4292,东莞市驰银川东科技有限公司
666.5,东莞京东利昂贸易有限公司
90000,嘉兴科民电子设备技术有限公司
500,乐陵丽舍纺织品有限公司
80,深圳宜居装饰风格材料有限公司
1263,广州市谊华科技服务有限公司
1154,苏州乌米贸易有限公司
24600,GA
175,畅天五金工具店
191,东莞京东利昇贸易公司
392.4,广州晶东贸易公司
119,深圳市愉康大药房
650,深圳市福田区海纳五金门市部
10970,哈尔滨市道外区佰沃化验仪器销售部
1936,上海纵信生物科技有限公司
119.3,无锡晋亚斯商贸有限公司
6400,上海缔彩科贸有限公司
13500,北京纽比特科技有限公司
7470,上海飞轩生物科技有限公司
4860,南京建成生物工程研究所有限公司
109.89,东莞市浩然纸业有限公司
250.6,哈尔滨宝源实业有限公司
86.8,优晶慧科技发展（北京）有限公司
82,南京睿琦优电子商务有限公司
1900,章瑞
600,北京博雅聚智新技术有限责任公司
7490,河南中镜科仪科技有限公司
800,天津海乐威电子
2190,汇欧五金家具制造有限公司
192,开化顺生电子科技有限公司
10952.4,无锡市棱谱光学仪器有限公司
1160,济南阿尼美汽车配件
388,浙江家超
464.6,山东原晶电子科技有限公司
408.5,天天阳光办公专营店
3119.99,深圳拓扑精膜科技有限公司
14100,上海柏真化学技术有限公司
33,徐州青藤家居
1000,"\n深圳市研顺世纪贸易有限公司"
3091.82,深圳市南山区再兴装饰材料商行
8580,重庆市北碚区博科生物制品经营部
8580,北碚区国科实验器材经营部
2554.8,苏州金唯智生物科技有限
93357.87,深圳研顺生物科技有限公司
1000,埃肯国际贸易（上海）有限公司
8689,深圳市梓健生物科技有限公司
998,无锡戴尔蒙科技有限公司
564,海门市古德实验器材经营部
40,先科SAST
48,绿之源
10044,爱普生epson
37100,上海福拜生物科技有限公司
31103,朔纶有机光电科技（北京）有限公司
2334,宁波市鄞州姜山新星教具厂
3600,苏州云泰生物医药科技有限公司
168.5,北京迪麦佳商贸有限公司
5324.55,广州市珈源医学试剂有限公司
10000,深圳市南山区国威电脑商行
1005.4,深圳腾云驾雾干冰科技有限公司
11498.69,深圳杰威教育发展有限公司
9800,广州瑞巍尔医疗科技发展有限公司
15.04,如皋市朋联五金有限公司
9251,深圳市南山区创宝航电子通讯经营部
905,广州市顺梓静豪科技有限公司
2420,深圳南山创宝航电子通讯经营部
1803.8,百安居装饰建材
1462.6,深圳宜家家居
312.5,慈溪市普慈电子有限公司
13425,深圳市福田区天宇隆电子销售部
2177.2,中山市古镇极固照明电器厂
162.5,深圳市龙华新区观澜鑫富康文具劳保店
2187,深圳市森威特环保科技有限公司
344.7,海门市安科实验器材经营部
35995,深圳市浸会仪器设备有限公司
2000,中科锐博实验器材商城
1915,福州英讯光电科技有限公司
12960,苏州铭鹄电子科技有限公司
240,深圳市福田区新亚洲电子市场二期亿润源电子经营部
1180,无锡市谱昕光学仪器有限公司
82,福州市仓山区叶燕飞五金店
1556,深圳市洁盟清洗设备有限公司
802,合肥华邦无尘材料有限公司
78568,深圳市国康科技有限公司
4490,厦门万和信生物科技有限公司
3870,厦门昂扬实验仪器有限公司
71197,厦门鹭隆生物科技发展有限公司
7270,苏州多多化学科技有限公司
8910,广州赛库生物技术有限公司
2000,基因生物技术国际贸易（上海）有限公司广州分公司
1414.1295,海门市北翌实验器材经营部
720,"\n深圳市佐料生物技术有限公司"
3216,LABBIO
4440,合肥启思迈商贸有限公司
4905,深圳市瑞鑫达有限公司
11680,天津市河北区高仕横泰实验室设备销售中心
1420,深圳市瑞鑫达化玻仪器有限公司
4877,深圳市宝安区新安凌云电子商行
999,台州市英明贸易有限公司
1011,钦礼慧数码产品
115,广州市海珠区飞舜玩具店
596.73,东莞市索奥复合材料制品有限公司
508.8,深圳市希望指数科技有限公司
9708.2,深圳市科发电子有限公司
282.8,北京北新科技
1270.02,杭州龙邱电子科技有限公司
11887,深圳市南山区深丰科技经营部
2310.79,深圳市南山区凌风电脑配件经营部
257.97,上海沃购在线电子商务有限公司
2798,广州达宏生物科技有限公司
14650,深圳市南山区荣发阳电子经营部
4439.98,上海泰坦科技有限公司
2640,威海晨源分子新材料有限公司
21559,深圳市辉翔光机电公司
75689.77,深圳市新伟明光电技术有限公司
7200,苏州纳微科技股份有限公司
10560,深圳市阳光视觉科技有限公司
1200,深圳睿迅有机太阳能有限公司
80.68,北京华实鸿业科技有限公司
4748,成都福誉科技有限公司
1314.7,滨州普翼达航空科技有限公司
288.6,成都伊佰特电子科技有限公司
318,东莞市火山口模型科技有限公司
30,深圳市华裕锴电子科技有限公司
367,杭州萧山橄榄山电子商行
104,郑州市克咪达电子技术有限公司
915,深圳市亮捷科技有限公司
100,华为代理
611.1,上海博由碳制品有限公司
145,临沂久克五金工具有限公司
175,东莞市硕纤电子科技有限公司
190,温州市龙湾状元宇邦五金经营部
297.8,西安沐易家居用品有限公司
66.8,青岛布朗工艺制品有限公司
30572.25,戴迪卡（深圳）科学技术有限公司
13078,深圳市金明珠科技有限公司
1080,广州赛哲
154,深圳市德玛电子有限公司
43050,深圳市誉和钻石工具有限公司
84.4,佛山市荣丰有色金属经营部
113.85,深圳市龙岗区金骏泰螺丝店
200,深圳市宝安区沙井鸿量仪器经营部
