订单总价,供应商名称
174.6,苏州市国税局第一税务分局航信代开点
383,深圳市红罗贸易有限公司
400,深圳市福田区信泰微电子
355,佛山市必装备工具有限公司
315,台州市艾测仪器有限公司
359.56,国家税务总局深圳市福田税务局（电子发票）
334,湖南凯姆五金建材有限公司
164.2,华润万家有限公司
3900,广州市白云区石井铂达公路建设仪器经营部
8938,广州市盾诺科学仪器有限公司
960,深圳市南山区永腾达五金机械维修部
5165,中国科学院成都有机化学有限公司大邑分公司
120,山西中兴环能科技有限公司
393.05,佛山佰兑网络科技有限公司
2004.59,江门市新会区今古洲新联制衣厂
92,郑州酷美商贸有限公司
5593.99,深圳市阿帕奇生物技术有限公司
395,众环同诚（惠州）金属制品有限公司
167.98,武义兴全贸易有限公司
188,新乡市红叶教学仪器有限公司
4760,西安市碑林区金亿泰尚电子产品经营部
343,深圳市众诚生态环境工程有限公司
54.9,杭州林夕文化创意有限公司
115,乐清市迈高电子商务有限公司
980,孙兰萍
103,沭阳县天萧园艺场
315.2,漳平市永福志坚花木场
1594,深圳市福田区一开五金电器商行
880,沭阳政之源电子商务有限公司
199,浙江平湖市新秀集团有限公司
151,深大南校区荔园校园商店
29580,深圳市宏恒星再生科技有限公司
552.5,广州致研仪器仪表有限公司
2090,上海百灵威化学技术有限公司
336,广州米橙科技有限公司
742.2,广陵区鑫贵五金经营部
400,云南干冰
372,宿迁尼禄商贸有限公司
2499.99,金坛经济开发区瑞声音响机架厂
35493,武汉盎秉捷科技有限公司
243.34,乐清市台帆电子商务有限公司
43,中山市古镇亮拓照明经营部
2380,福州伟博电讯有限公司
1502.7,杭州网易严选贸易有限公司
15990,天津深蓝易源生物科技有限公司
11880.4,深圳吉兰泰电子有限公司
2487,桓台县城区贝乐百货商行
958,深圳讯销科技股份有限公司
7.8,漳平市丽云贸易有限公司
28,郑州科建图书有限公司
59,固始县段集镇豫嘉百货店
150,深圳市南山区立德新耗材经营部
346,鹤壁市淇滨区税务局
4555,广州贵永仪器有限公司
2940,深圳市南山区飞速阳光电脑经营部
428,深圳市弘文艺术有限公司
600,深圳市南山区桃源御田桶装水店
212,杭州长城机电市场余银瑞五金经营部
130,东莞市黄江启弘塑胶原料经营部
699.15,小风3D
600,中科雷鸣(北京)科技有限公司
2700,浙江立晶
1010.22,广州市海珠区兰冠贸易商行
699,深圳开博尔科技有限公司
8800,北京浩凌科技发展有限公司
400,广州杨阳贸易有限公司
9900,深圳市长征生物科技
900,济宁儒佳检测仪器有限公司
430,济宁均测仪器设备有限公司
860.08,上海顺潮科技有限公司
313.5,科明电子机电
280,深圳市哈博金属有限公司
433,深圳市龙岗区赛格电子市场立荣电子经营部
5605,深圳市南山区茂涵电脑商行
23507,深圳市南山区众拓时代电子经营部
2820,深圳市南山赛格阳光瑞盈数码经营部
6475,湖州鑫翔陶粒制品有限公司
5830,深圳市南山区星耀云电子商行
5892,深圳市南山区兴远近数码经营部
228,上海齐谦学实业有限公司
174.7,大沥铝型材
23263.18,深圳市南山区睿通恒业电子经营部
2600,港深数码科技（深圳）有限公司
650,斯尔特机电设备
2200,宜兴市精瑞光学元件厂
689.8,东莞市常平华载仪器经营部
900,伽蓝特
84258,武汉瑞仪达科技有限公司
9000,武汉宏辰星科技有限公司
48000,西安塞隆金属材料有限责任公司
1500,上海亚亦生物科技有限公司
8988,深圳市南山区德银电脑耗材，南山区通网易电子
148.68,宿迁山蒲电子商务有限公司
596,三亚京东东佳禹贸易有限公司
5991.03,南山区福燕电脑科技经营部
365,利民TFX
182.8,coolermaster
445.41,鹤壁诚信仪器
5262,深圳市舫森科技有限公司
5816,陕西皇朝航空科技有限公司
999,武汉鑫致酷数码科技有限责任公司
158.4,晨星泰合（天津）科技有限公司
235,京口区三维科创模型经营部
38.3,上海阗泽五金机电有限公司
3605.88,深圳市美牙牙医疗器械有限公司
106,顶盛轴承
5320,深圳市恩维科技有限公司
439,深圳市传奇伟业电子有限公司
499,上海帝爱商贸有限公司
450,苏州鑫煜斯金属制品有限公司
66,杭州雅舍家居有限公司
74,上海市杨浦区奕恺计算机经营部
45.8,庆云鹤东林商贸有限公司
13800,深圳市星驰云电子商行
18550,深圳市南山区凯视安防经营部
13086,深圳智远达科技有限公司
5972,深圳市天下风贸易有限公司
200.4,乐清市河合贸易有限公司
56.4,睿亚公司
6300,南阳市晶亮光电科技有限公司
68,厦门市九柜贸易有限公司
3150,韦氏纳米系统（深圳）有限公司
9480,西安市鑫佳悦电子商行
3000,晨翔鑫数码
53.6,商丘思南网络科技有限公司
2650.482,深圳市南山区时讯数码商行
1950,西安市高新区远文商行
28733,上海拓陶生物技术中心
5200,深圳翠博微系统有限公司
156,广州市爱鱼人水族用品有限公司
270,温州昂邦电器有限公司
1373,云龙区映洋石五交化经销处
330,东莞市铂爵金属材料有限公司
60,乐清市和冠电气有限公司
1300,佛山市南海区长源化玻仪器商行
285,杰出五金厨具厂
45900,深圳市华鑫立业科技有限公司
1587,英潍捷基（上海）贸易有限工商
156,深圳市森泰达激光科技有限公司
60,盱眙后十年广告有限公司
257.55,衡水轩昂仪表有限公司
14699,深圳市森元科技有限公司
9927.77,深圳市森维凯科技有限公司
4000,珠海市森扬科技有限公司
134,深圳市爱立通电子科技有限公司
8285,领德光电
640,领德科技
320,深圳市南山区清泉饮水店
349,敏腾视觉科技（深圳）有限公司
14360,深圳奇点高新科技有限公司
21680,东莞市和智信息科技有限公司
195,沐阳梦尔琪商贸有限公司
17825,宏鹏电子
200,上海松静新能源科技有限公司
800,杭州高烯科技有限公司
150,广州瑞欣科学仪器有限公司
63,南京比兰卡建材有限公司
5400,东莞双平
1710,昆山市优谦冷暖设备材料经营部
122,福州市仓山区美合塑胶制品经营部
57318,上海务真光电技术有限公司
1342,广州米恩生物科技
46.9,紫光股份有限公司
773,深圳市博莱森电子科技有限公司
571.8,北京中科凌宇传感技术有限公司
321.98,云阳县栖霞镇线艺嘉电子加工厂
600,广州电捷电子有限公司
393,深圳市天成微电子有限公司
148.8,宁海裕顺商贸有限公司
5100,南京业康微波技术有限公司
60,宁波汇普五金工具有限公司
42,金华成楷信息科技有限公司
91.7,义乌市略彪贸易有限公司
276.32,深圳市必趣科技有限公司
1590,武汉恒科佳越科技有限公司
22880,深圳市豫捷五金有限公司
56940,合肥市蜀山区美科美生物试剂经营部
450,深圳微钻信息科技有限公司
950,深圳微钻科技信息有限公司
12100,卡梅德生物科技（天津）有限公司
145,北京·全式金生物科技有限公司
24444,江苏金斯瑞生物科技有限公司
13998,北京中翰仪器有限公司东莞分公司
550,广州市明美光电技术有限公司
240,海宁市丁桥安邦建材经营部
4319.7,献县仁德建材门市部
413.88,深圳市楚云办公设备有限公司
4039,深圳市行芝达电子有限公司
18600,上海陶速生物科技有限公司
345,徐州樊越仪器仪表有限公司
850,北京仪电科技有限公司
29640,青羊区天誉商贸部
18000,青羊区宏图电子产品经营部
29850,武侯区蓝图浩兴商贸部
29700,武侯区创源电子产品经营部
26400,武侯区弘煜电子产品经营部
2000,光扬电脑配件经营部
2000,晨翔鑫数码经营部
35,莆田市沐觉贸易有限公司
25049,武汉汉宁轨道交通技术有限公司
11722,杭州航翔气体有限公司、安吉天荒坪天耀五金建材商行
696,上海顶慧商贸有限公司
949,华硕电脑有限公司
14000,深圳市航纬电子有限公司
4452.56,淘宝、京东
700,安徽时代中佳科贸有限责任公司
41.9,深圳市福田区一八电子经营部
170,山东中科智能设备有限公司
310.03,深圳市博立方科技有限公司
23640,深圳市义邦科技有限公司
26970,深圳市锐杨科技有限公司
600,深圳信盈达科技有限公司
36695,深圳市南山区中原汇电子经营部
393.2,杭州印象视觉电子商务有限公司
3649.99,深圳市华思源科技有限公司
241.6,韩都衣舍电子商务集团股份有限公司
494.8,广州初语服装设计有限公司
641.4,东莞市圣越服饰有限公司
640,海门市沃克尔实验器材经营部
116.15,东莞市樟头木苏元塑胶原料经营部
38,盐城市南新区科盾办公用品经营部
9656,淘宝商家
969,北碚区盛新仪器经营部
420428,广州昂昇光电科技有限公司
558.8,广州晶东商贸有限公司
205,连山壮族瑶族自治县喜峰干冰销售部
4000,广东普加福光电科技有限公司
6300,深圳市瑞亦泰科技有限公司
2550,惠州市惠城区科大五金经营部
180,允研新材料（上海）有限公司
9230,上海所元新材料有限公司
4560,深圳市朗格明贸易有限公司
160,杭州索影科技有限公司
544,夏秋月
2380,深圳市爱莱尔科技有限公司
1116,440300073390652
5460,ublox
2600,深圳市安防部落科技有限公司
7990,祥志阳电子
489,上海芮森摄影器材有限公司
2500,北京智元创新科技有限公司
24000,深圳市释德教育咨询有限公司
3378,易莱锦生物工程（上海）有限公司
25800,星启视觉
29200,纳子文化传播有限公司
4910,深圳市育新科技有限公司
309.08,鋆大生物科技（上海）有限公司
29000,武汉安扬激光技术有限责任公司
512.8,常州三泰科技有限公司
1560,广州市流式生物科技有限公司
674,徐州亚明仪器仪表有限公司
535,苏威
140,米塔克合金
126,润友化学
260,深圳市军横鸿科技有限公司
1535.83,贸泽
84.5,姜堰区沿河实验器材经营部
91.1,广州市荔湾区新普达文具商行
222.2,北京凯发特陶会计有限公司
141.4,东莞市维佳塑料制品有限公司
20000,凌志新辉光电
504,义务龙哲电子商务有限公司
29800,深圳依贝奥智慧生物科技有限公司
1425.32,上海泰珊贸易有限公司
153.6,沐阳县敏之慧电子商务有限公司
310,赛博电化学材料网
410,五花旗舰店
5110,深圳市美控特塑料有限公司
18349.514565,东莞市长安隆普泰五金机械经营部
19550,东莞市长安陆发五金机械经营部
300,东莞市宏新金属材料有限公司
439.5,海门市海特实验器材经营部
677,张店泽玥电子产品商行
153.84,上海开米科技有限公司
3060,北京通世华港设备有限公司
500,深圳华中实验室设备有限公司
600,深圳华中实验设备有限公司
3415,小米之家商业有限公司
192.25,深圳市光明新区公明新国生包装材料行
1219.98,无锡泽嘉分析仪器有限公司
292.3,上海卫丞商贸有限公司，东莞京东利昇贸易有限公司
106.05,深圳市宝安新区和记电子产品经营部
3306,哈尔滨市南岗区天勤实验器材经销部
5120,哈尔滨市道外区新峰生物试剂销售部
5787,哈尔滨市道外区三丰实验用品销售部
5787,哈尔滨市道外区英骏生物试剂销售部
108.7,福州市仓山区类合塑胶经营部
4510,广州市予华仪器有限公司
1306.5,益白通
179.7,人人乐
12462.4,深圳市百奥吉生物工程有限公司
4400,上海晟延生物科技有限公司
243,无锡市沃野机电设备有限公司
96,郑州妆森商贸有限公司
311,深圳市宝安区松岗晴川文具劳保用品商行
920,昆山泰铂特控温科技有限公司
353.5,深圳市嘉译鑫精密管业有限公司
171,唐山市开平区兴易耗材商行
126,诸暨市工友机电超市有限公司
2300,深圳市美速达五金塑胶制品有限公司
370,上海碧嘉商贸有限公司
815,深圳华兴茂科技有限公司
2340.4,深圳同创声学灯光工程有限公司
400,深圳市雷特运贸易有限公司
1400,江苏吉阿生物科技有限公司
1084,京东3M官方旗舰店
1080,上海洁安流体科技有限公司
674.2,沧州德安防爆特种工具制造有限公司
2521,深圳市海王星辰健康药房连锁有限公司
255,3m
396,西安市长安区风腾科研试剂耗材经销部
7600,合肥予华仪器有限公司
696.6,深圳市凌龙自动化设备有限公司
922.52,Sigma-Aldrich
88,深圳市霸王贸易有限公司
81,建湖职环电子科技有限公司
110,西安市雁塔区正行电子商行
10200,深圳市斯坦美斯生物科技有限公司
933,华鑫电子科技
7011,深圳市南山区屹磊商贸产品销售部
8100,深圳市南山赛格电子市场佳亨电脑展销部
128,郑州市慧能自动化仪表有限公司
93,南京和华机电设备销售中心
800,中国建筑材料科学研究总院有限公司
630,香河京通运加制冷设备销售有限公司
576,立潽制冷设备经营部
440,北京西湾光电有限公司
122,深圳市华尚誉科技有限公司
4500,深圳市高光信通光电科技有限公司
64,海德能环境科技有限公司
35.2,重庆市大足区兴德顺五金厂
85,佛山市金和润五金电器有限公司
512,宜兴市谱创光学仪器经营部
268.41,深圳市威震兴电子科技有限公司
98,北京市北方办公用品公司
300,深圳徕越生物技术有限公司
310,清河县瑞航金属材料有限公司
1769,献县维斯特仪器销售中心
240,大连靓宣生物科技有限公司
27481.14,深圳市宝安区新安科鑫试验设备商行
2550.15,成都瑞芬思生物科技有限公司
55042.52,深圳昌泰化工科技有限公司
1780,上海握富光电科技有限公司
1,深圳市XXX
2880,株洲市宇捷光电科技有限公司
52,上海树袋熊胶粘制品有限公司
28800,安徽华矅农业科技有限公司
50,上海创跃网络科技有限公司
599,深圳市嘉亿通科技公司
12640,武汉中科兴达技术有限公司
100,莆田市爱品贸易有限公司
2874,深圳市睿淳科技有限公司
4620,广州市赋奇自动化设备有限公司
980,联威大型激光切割
40.4,海陵区八个点橡塑制品经营部
25.9,安徽竞怡电子商务有限公司
2350,锦州锦达石英玻璃发展有限公司
375,北京中科二环科技有限公司
432,郑州商之祺贸易有限公司
901,南京市秦淮区清思研耗材销售中心
210,东莞市强兴旺实业有限公司
102,江都区星海电子配件厂
1840,北京百奥莱博科技有限公司
9883,百灵威科技有限公司
2452,上海炫飞数码科技有限公司
5721,深圳市南山区磊科数码赛格经营部
369.93,昆明市五华区鹏莱实验耗材经营部
3344.65,长沙小优机器人有限公司
32,安徽育安科教文化有限公司
96,北京旷氏文豪文化传播有限公司
5555,博罗县石湾镇易得商贸行
8580,博罗县石湾镇源弘精密设备贸易部
35.9,上海煜韩环境科技有限公司
191.1,天台县益婷实验器材经营部
368.65,抚顺市望花区佳纯商行
34.5,北京跃腾达科技有限责任公司
1210,深圳市云飞龙特种气体
225,东莞市横沥创棋绝缘制品营业部
177,惠州市全美事业有限公司
39,北京天姿依美服装科技有限公司
400,南京韩圩生物科技有限公司
2400,岳阳科德设备有限公司
103.02,鼎燊包装材料有限公司
100,易发电子材料商行
75,华阳化工有限公司
78,易恒达建材经营部
105.6,齐翼材料有限公司
70,红梅鹏笑办公用品商行
1200,北京市汇力百通工贸有限公司
1699,深圳泽艺达摄影器材有限公司
4000,北京艾可纳光电科技有限公司
661,深圳华安天下
4414,芯驿电子科技（上海）有限公司
422.6,深圳市福田区晶兴微电子商行
349,深圳今盈电子商务有限公司
417,宁波樱花家电制造有限公司
4823.3,太原蓝思电池销售部
1008,深圳市百胜商贸有限公司
1780,安庆市天隆电子科技有限公司
101.57,蚌埠市逸飞教具经营部
148.8,深圳市宏泰轩贸易
100,厦门市集美区熠扬五金经营部
70,上海竞维机电
70,深圳市华金科技有限公司
548,广州基座光学科技有限公司
960,深圳市洁亮服务有限公司
498,海门市中科锐博实验器材经营部
1685,深圳市曼拓科技有限公司
112,深圳市砍树科技有限公司
5700,江苏培蕾基质科技发展有限公司
499,深圳市顺电欧洲城店
170.4,宜兴丰得隆电子商务有限公司
6840,重庆科析仪器成套有限公司
4240,京基百纳广场
1068,华润中心.万象城
2397,深圳常兴天虹
999,深圳沙河天虹
9945,香港沙田广场
498.01,百仕达东郡广场
9300,公明金通成量工量具商行
249.5,深圳市俩棵树科技有限公司
62.6,力箭工具旗舰店
111.14,斯勃锐
140.4,成都祥隆电子科技有限公司
59,东莞东城尚亿电子商行
370,上海松行贸易发展有限公司
29900,深圳市德创建筑有限公司
9975.52,北京理波光谱物理科技有限公司
290,上海习仁科学仪器有限公司
186,宁波萃英化学技术有限公司
905,福州百思创新材料科技有限公司
13,龙泉市华丝绵家纺用品厂
288,项城市升聚商贸有限公司
78,永康市学友教具有限公司
1080,天津市河北区宏利新源实验室器材经营中心
950,苏州川茂金属材料有限公司
2000,厦门中和光电科技有限公司
225,淮安馨心语国际贸易有限公司
597.67,天津市天悦家居用品有限公司
274,赣州民尚商贸有限公司
403.02,上海虔轩照明电器有限公司
92.04,沭阳县木风商行
355.5,上海微神新型建材有限公司
150,东海县明杰石英制品有限公司
164,广州楷翔电子产品有限公司
177,深圳昌达盛电子有限公司
295.8,深圳市光明新区全鑫文具劳保经营部
132.6,苏州高新区狮山创凡优电子商行
56.45,深圳市宝安区沙井奥优商行
39.9,揭阳市康夫电子商务有限公司
1066.51,北京信诺迈驰教育科技有限公司
5870,深圳市南部山区大森电子经营
37540,西安博研微纳信息科技有限公司
2120,深圳市南山区楠亮电子经营部
538.8,深圳市福田区品航科运动智能商行
780,SMB-JY
37.8,中山天绘打印耗材有限公司
8100,深圳市南山区深鹏星电脑经营部
37,上海京恒五金机电设备有限公司
582,清河县腾丰金属材料有限公司
39.9,上海勇王包装制品有限公司
420,北京瑰夏传奇贸易有限公司
10,泰州宇虹新材料科技有限公司
230.5,泰州虹宇新材料科技有限公司
10165,湖南长仪微波科技有限公司
1180,湖南长沙微波科技有限公司
1960,杭州柏思迈尔生物技术有限公司
93.5,江阴聚可爱贸易有限公司
31.002,江都区中奇教学仪器经营部
46.002,上海廊菲仪器设备有限公司
101.019,无锡汇浩瑞气动元件有限公司
69,义乌市温庭电子商务有限公司
3027,酷奇数码专卖店
20.8,科宇华亚数码配件专营店
118,深圳奥斯丽科技有限公司
75,淘宝欣扬数码
1179.99,天猫华宾旗舰店
100,洁纤防静电科技
173,开化县华锐硅材料经营部
31.45,上海优溪实业有限公司
97.6,义乌市振韵日用品有限公司
455,东莞三量量具有限公司
32,嘉兴市秀洲区王江泾图乐日用品网店
223,珠海市乐天购科技有限公司
76.75,天猫炜禹旗舰店
330,淘宝雷赛机电
5800,虹越花卉股份有限公司
193.3,东莞市高盛通用仪器有限公司
300.97,灵寿县金运矿产品加工厂
1597,淘宝网
193.08,丹阳市骋鸣纸业有限公司
2600,深圳市南山区赛格电子市场鼎利展销部
129,海陵区友佳慧图文设计工作室
15500,深圳市维锐科技有限公司
259,北京天勤世纪科技发展有限公司
2739,深圳恒通精密仪器
1090,深圳市卓顺仓储设备有限公司
656,苏州市相城区黄桥金宏伟钢木金属制品厂
130,文圣区创雅广告装饰中心
208,深圳市顺电连锁股份有限公司
354.9,永嘉县乌牛街道昊炀电器经营部
522,深圳市君悦智控科技有限公司
1058,深圳市导向电机技术有限公司
7822,顺德区大良蓝力模型
46,上海永恒实业有限公司
850,慈溪市创想快速成型技术有限公司
190,深圳市宝安区沙井格林斯亚克力经销部
88,永康市海乾贸易有限公司
6200,芜湖隆吉商贸有限公司
28.8,温州威翰商贸有限公司
150,河南诺巴迪材料科技有限公司
1800,上海狄昊实业发展有限公司
2500,深圳市凯创科技有限公司
409.98,姑苏区兆盛不锈钢五金经营部
426.68,深圳市龙华新区大浪速达电脑经营部
6000,洛阳通威新材料科技有限公司
244,惠州伏特能源有限公司
1457.5,江西联信大市场威尔仪表销售部
1316,吉尔森精密仪器有限公司
258.3,英滩捷基贸易有限公司
14765.5,深圳市南山区中南电子经营部
5500,中镜科仪技术有限公司
156,武进区潞城富达塑料制品经营部
1350,武汉楚星光纤应用技术有限公司
101.8,深圳市海诚胶粘制品
99.7,深圳市科路士科技有限公司
2316,西安市碑林区洪辰水热设备供应部
153.6,建湖县明启玻璃仪器
272.7,阜宁县博文实验室用品经营部
90,程度华艳医疗器械有限公司
225,上海乐兹科技发展有限公司
51.6,成都亿佰特电子科技有限公司
2250,天津市西青区雷瑞科实验器材销售中心
107.7,深圳市福田区广和文具店
492,建湖县闪耀电子科技有限公司
360,东莞市潮智实业有限公司
1757,台州市黄岩美客贸易有限公司
62,广州市铨之友网络科技有限公司
11400,深圳市鹏越科技材料有限公司
11600,深圳市太古建材有限公司
66.8,泰安市泰安区天佑商贸有限公司
226,北京嘉康金日科技有限公司
300,斯尔特机电设备有限公司
450,安徽鑫大汽车配件有限公司
354.4,广东万利电子商务有限公司
13700,深圳市宝安区石岩嘉航电脑店
12800,深圳市钧匀光电科技有限公司
335.6,深圳御儒科技有限公司
65,东莞市南城光龙文化用品商行
150,深圳市金华胜电线电缆有限公司
2009.9,良程（北京）科技有限公司
246.8,上海兔觅实业有限公司
4202.5,常州桦立柯新材料有限公司
4790,天津市河北区禾泰明贺实验室器材经营部
110,佛山市顺德区道硕五金塑料制品有限公司
240,桂林咚杰丽媛贸易有限公司
228.52,茶花家居用品
9600,天津嘉银纳米科技有限公司
234,云翔光电
200,海盛石英科技
3180,北京楚齐科技有限责任公司
14190,上海璨科信息技术有限公司
197,中山市美亮佳美容用品有限公司
79.8,上海强鑫电子信息技术有限公司
126.5,深圳市好友佳办公用品经营部
354.88,上海大澜电子商务有限公司
111.89,杭州宾致商贸有限公司
320,上海生物工程（上海）股份有限公司
2824,华润万家生活超市（广州）有限公司
306.5,海宁上匠工具有限公司
118.8,沭阳县暮春园艺中心
14228,广东华东信通电线电缆有限公司
380,市北区海晴科批发经营部
2000,苏州靖昇电子科技有限公司
360,北京凯发特陶科技有限公司
28098,药明览博（武汉）化学科技有限公司
4000,上海毅夫自动化科技有限公司
28920,南京惯威传感科技有限公司
985,深圳铭睿达图文设计有限公司
65,乐清市柳市一枭电器经营部
120,深圳市宏达激光科技有限公司
884,全瑞视讯摄像头工厂店
313,上海付享光学仪器有限公司
239.000001,荷塘区威弗思光电营业部
10598,索雷博光电科技(上海)有限公司
23452.95,深圳市南山区鑫兴恒电子经营部
380,深圳市优加精密有限公司
160,保定奇旅箱包制造有限公司
138,深圳市美猫创意科技有限公司
21058,深圳市南山区金新源商行
314.62,宁乡海金润润滑油
7760.3,深圳市宏盛智能化机电工程有限公司
4000,深圳市罗湖区佳兴商店
47.65,徐州绮绣家纺有限公司
1111.3,北浩源电脑经营部
13,乐清市乐成奥杰店
10.98,深圳百瑞特紧固件公司
15.79,科比电子公司
285,深圳市南山区华厦电子商行
9150,深圳市南山区卓正体育用品店
945,广州华瑞健体育活动策划有限公司
1888,上海柏益思生物技术有限公司
56,沐阳县河清园林绿化有限公司
156,沐阳县萱东苗木有限公司
35,沐阳顺诺商贸有限公司
2400,武汉市菲优姆科技有限公司
3275,深圳市信达电路科技有限公司
990,深圳市客吉莱商贸有限公司
1565,蔚仪金相试验仪器有限公司
210,中电航宇（北京）技术有限公司
19976,深圳市富斯特建材有限公司
470,上海宙胜
411,兴化火丰不锈钢
500,深圳市汉鑫五金模具有限公司
480.76,东莞市广誉金属制品有限公司
18210,索科特智能设备有限公司
2900,合肥摩凯新材料科技有限公司
43797.9,埃尔斯（深圳）科技有限公司
278,四川文轩在线电子商务有限公司无锡分公司
4230,乐清光语生物科技有限公司
4900,上海光语生物科技有限公司
85,南京百炫电子科技有限公司
68,深圳市盛诺美科技有限公司
148,江阴力丰家居有限公司
165,上海敏焱塑胶制品有限公司
142,临安斯普利电子有限公司
336,深圳市巧琦贸易有限公司
460.8,卡川儿流体科技（上海）有限公司
2825.2,江苏集粹药康生物科技有限公司
500,成都正能生物技术有限责任公司
46977,北京博淼医学科技股份有限公司
205.8,东莞不凡电子有限公司
722,三极光电科技（苏州）有限公司
810,深圳市宝安区西乡正源传动商行
